Question,Answer
Who is Euclid?,Euclid was an ancient Greek mathematician often referred to as the Father of Geometry; He authored Elements; a comprehensive compilation of mathematical knowledge in geometry.
What is the significance of the Golden Ratio?,"The Golden Ratio - approximately equal to 1.618 - is a mathematical constant found in nature; art; and architecture. It has aesthetic and symmetrical properties."
Tell me about the contributions of Pythagoras.,Pythagoras; an ancient Greek mathematician; is known for the Pythagorean theorem; which relates the lengths of the sides of a right triangle.
When was calculus developed?,Calculus was independently developed by Sir Isaac Newton and Gottfried Wilhelm Leibniz in the late 17th century; It revolutionized mathematics and physics.
Who were the mathematicians of the Islamic Golden Age?,During the Islamic Golden Age (8th to 14th centuries); mathematicians like Al-Khwarizmi and Omar Khayyam made significant contributions to algebra; geometry; and trigonometry.
What is the history of zero in mathematics?,"The concept of zero evolved over centuries; with contributions from ancient Indian mathematicians. It became a fundamental concept in mathematics and a placeholder in numeral systems."
Tell me about the Renaissance period in mathematics.,"The Renaissance period (14th to 17th centuries) witnessed a revival of interest in classical mathematics; with figures like Leonardo da Vinci and Luca Pacioli making mathematical contributions."
Who is Ada Lovelace and what is her connection to mathematics?,"Ada Lovelace is considered the world's first computer programmer. She worked with Charles Babbage on the Analytical Engine and wrote the first algorithm intended for implementation on a machine."
What role did women play in the history of mathematics?,"Despite historical challenges; women like Emmy Noether; Hypatia; and Mary Cartwright made significant contributions to various mathematical fields."
Explain the significance of Hilbert's problems.,"Hilbert's problems were a set of 23 unsolved problems presented by David Hilbert in 1900; shaping the course of 20th-century mathematics. Some problems remain unsolved to this day."
Tell me about mathematicians in ancient Greece.,Ancient Greece produced influential mathematicians like Euclid; Pythagoras; and Archimedes who made significant contributions to geometry and number theory.
What is the Fundamental Theorem of Calculus?,"The Fundamental Theorem of Calculus states the relationship between the derivative and the integral and plays a crucial role in calculus. It was developed by Isaac Newton and Gottfried Wilhelm Leibniz."
Explain the concept of infinity in mathematics.,"In mathematics; infinity represents an unbounded quantity. It is used in calculus; set theory; and other branches of mathematics to describe values that are limitless."
Who was Sophie Germain?,"Sophie Germain was a French mathematician known for her work on elasticity theory and Fermat's Last Theorem. She made significant contributions to number theory and mathematical physics."
What is the history of algebra?,"Algebra has a rich history dating back to ancient civilizations. It evolved over time with contributions from mathematicians like Al-Khwarizmi; who wrote a book on solving quadratic equations."
Tell me about the mathematics of ancient Egypt.,"Ancient Egyptians developed mathematical concepts for practical purposes; such as measuring land and building structures. The Rhind Mathematical Papyrus is an example of their mathematical knowledge."
Who were the mathematicians of the European Renaissance?,"The European Renaissance saw mathematicians like Leonardo Fibonacci and Niccolò Tartaglia contributing to the revival of mathematical studies. Fibonacci introduced the famous Fibonacci sequence."
What is game theory in mathematics?,"Game theory is a branch of mathematics that studies strategic interactions between rational decision-makers. It has applications in economics; political science; and biology."
Tell me about famous women mathematicians.,"Many women mathematicians made significant contributions throughout history; including Emmy Noether; Hypatia; and Mary Cartwright. Their work spanned various mathematical disciplines."
What is the history of mathematical notation?,"The development of mathematical notation is crucial for expressing mathematical ideas. Symbols and notation evolved over time; with contributions from mathematicians like René Descartes and Leonhard Euler."